{
  "$schema": "https://json-schema.org/draft/2020-12/schema",
  "$id": "azeforge.acceptance/v1",
  "type": "object",
  "required": [
    "schema",
    "schemaVersion",
    "catalog",
    "entries"
  ],
  "additionalProperties": false,
  "properties": {
    "schema": {
      "const": "azeforge.acceptance/v1"
    },
    "schemaVersion": {
      "const": 1
    },
    "catalog": {
      "type": "object",
      "required": [
        "id",
        "version"
      ],
      "additionalProperties": false,
      "properties": {
        "id": {
          "const": "azeforge.acceptance/v1"
        },
        "version": {
          "const": 1
        }
      }
    },
    "entries": {
      "type": "array",
      "minItems": 1,
      "items": {
        "type": "object",
        "required": [
          "id",
          "gate",
          "area",
          "given",
          "when",
          "then",
          "evidence",
          "required",
          "contracts"
        ],
        "additionalProperties": false,
        "properties": {
          "id": {
            "type": "string",
            "pattern": "^P0[A-Z0-9]*-[A-Z]+-[0-9]{3}$"
          },
          "gate": {
            "enum": [
              "p0",
              "p0.5"
            ]
          },
          "area": {
            "type": "string",
            "minLength": 1
          },
          "given": {
            "type": "string",
            "minLength": 1
          },
          "when": {
            "type": "string",
            "minLength": 1
          },
          "then": {
            "type": "array",
            "minItems": 1,
            "items": {
              "type": "string",
              "minLength": 1
            }
          },
          "evidence": {
            "enum": [
              "automated",
              "manual"
            ]
          },
          "required": {
            "const": true
          },
          "contracts": {
            "type": "array",
            "minItems": 1,
            "items": {
              "type": "string",
              "minLength": 1
            }
          }
        }
      }
    }
  }
}
