{
  "schema": "azeforge.acceptance/v1",
  "schemaVersion": 1,
  "catalog": {
    "id": "azeforge.acceptance/v1",
    "version": 1
  },
  "entries": [
    {
      "id": "P0-DOC-001",
      "gate": "p0",
      "area": "document",
      "given": "Valid Engineering-notation Source",
      "when": "the compiler parses and validates it",
      "then": [
        "an error-free versioned serializable Document is produced"
      ],
      "evidence": "automated",
      "required": true,
      "contracts": [
        "#6"
      ]
    },
    {
      "id": "P0-DOC-002",
      "gate": "p0",
      "area": "document",
      "given": "Source with invalid regions",
      "when": "the compiler parses it",
      "then": [
        "valid regions recover into the Document",
        "errors prevent AzeDocument and Artifact production"
      ],
      "evidence": "automated",
      "required": true,
      "contracts": [
        "#6"
      ]
    },
    {
      "id": "P0-DOC-003",
      "gate": "p0",
      "area": "document",
      "given": "Source with metadata, version, or unknown-directive failures",
      "when": "the compiler reports Diagnostics",
      "then": [
        "each Diagnostic carries the correct SourceRange and lists alternatives"
      ],
      "evidence": "automated",
      "required": true,
      "contracts": [
        "#6",
        "#9"
      ]
    },
    {
      "id": "P0-DOC-004",
      "gate": "p0",
      "area": "document",
      "given": "Two Sources differing only in trivia, paths, diagnostics, ranges, or render options",
      "when": "both Documents are hashed",
      "then": [
        "both contentHashes are equal"
      ],
      "evidence": "automated",
      "required": true,
      "contracts": [
        "#6",
        "ADR 0002"
      ]
    },
    {
      "id": "P0-DIAG-001",
      "gate": "p0",
      "area": "diagnostics",
      "given": "A failing compilation",
      "when": "an author reads the human Diagnostic report",
      "then": [
        "every Diagnostic is line-specific and author-facing"
      ],
      "evidence": "automated",
      "required": true,
      "contracts": [
        "#9"
      ]
    },
    {
      "id": "P0-DIAG-002",
      "gate": "p0",
      "area": "diagnostics",
      "given": "A failing compilation",
      "when": "a tool reads the JSON Diagnostic report",
      "then": [
        "stable code, data, range, order, and fix semantics are preserved"
      ],
      "evidence": "automated",
      "required": true,
      "contracts": [
        "#9"
      ]
    },
    {
      "id": "P0-DIAG-003",
      "gate": "p0",
      "area": "diagnostics",
      "given": "Malformed input or a component fault",
      "when": "the compiler handles it",
      "then": [
        "the fault is bounded, redacted, and contained without crashing"
      ],
      "evidence": "automated",
      "required": true,
      "contracts": [
        "#9"
      ]
    },
    {
      "id": "P0-PLUGIN-001",
      "gate": "p0",
      "area": "plugin",
      "given": "The built-in registry, schemas, versions, and capabilities",
      "when": "they are constructed",
      "then": [
        "construction is deterministic",
        "ambiguous registrations are rejected with a stable error"
      ],
      "evidence": "automated",
      "required": true,
      "contracts": [
        "#7"
      ]
    },
    {
      "id": "P0-PLUGIN-002",
      "gate": "p0",
      "area": "plugin",
      "given": "A Plugin, Block renderer, or Renderer fault",
      "when": "the fault fires mid-render",
      "then": [
        "partial Artifacts are discarded",
        "ordered Diagnostics are preserved"
      ],
      "evidence": "automated",
      "required": true,
      "contracts": [
        "#7"
      ]
    },
    {
      "id": "P0-CLI-001",
      "gate": "p0",
      "area": "cli",
      "given": "A Source render",
      "when": "it succeeds or fails",
      "then": [
        "success atomically commits exactly one requested Artifact",
        "failure preserves the prior Artifact"
      ],
      "evidence": "automated",
      "required": true,
      "contracts": [
        "#8"
      ]
    },
    {
      "id": "P0-CLI-002",
      "gate": "p0",
      "area": "cli",
      "given": "Stdin, stdout, format, and destination modes",
      "when": "they are exercised",
      "then": [
        "behavior matches the CLI contract including binary-terminal denial"
      ],
      "evidence": "automated",
      "required": true,
      "contracts": [
        "#8"
      ]
    },
    {
      "id": "P0-CLI-003",
      "gate": "p0",
      "area": "cli",
      "given": "Validate and format commands",
      "when": "they run",
      "then": [
        "each executes only its specified layers and write modes"
      ],
      "evidence": "automated",
      "required": true,
      "contracts": [
        "#8"
      ]
    },
    {
      "id": "P0-CLI-004",
      "gate": "p0",
      "area": "cli",
      "given": "A watched Source with discovered and missing dependencies",
      "when": "it changes and breaks",
      "then": [
        "rebuilds serialize",
        "failure preserves the prior Artifact"
      ],
      "evidence": "automated",
      "required": true,
      "contracts": [
        "#8"
      ]
    },
    {
      "id": "P0-CLI-005",
      "gate": "p0",
      "area": "cli",
      "given": "A served Source",
      "when": "it is previewed",
      "then": [
        "the server is loopback-only and constrained",
        "it exposes current Diagnostics rather than stale content"
      ],
      "evidence": "automated",
      "required": true,
      "contracts": [
        "#8"
      ]
    },
    {
      "id": "P0-CLI-006",
      "gate": "p0",
      "area": "cli",
      "given": "Every CLI command",
      "when": "it exits",
      "then": [
        "exit codes, stdout purity, finite JSON, NDJSON lifecycle, quiet mode, and signal cleanup match the CLI contract"
      ],
      "evidence": "automated",
      "required": true,
      "contracts": [
        "#8"
      ]
    },
    {
      "id": "P0-CLI-007",
      "gate": "p0",
      "area": "cli",
      "given": "Capability and version reports",
      "when": "they are requested",
      "then": [
        "they are complete, deterministic, local-only, and truthful"
      ],
      "evidence": "automated",
      "required": true,
      "contracts": [
        "#8"
      ]
    },
    {
      "id": "P0-EQN-001",
      "gate": "p0",
      "area": "equation",
      "given": "Readable equation Blocks",
      "when": "they render",
      "then": [
        "HTML carries visual plus MathML pairs and visual Artifacts stay consistent"
      ],
      "evidence": "automated",
      "required": true,
      "contracts": [
        "#7"
      ]
    },
    {
      "id": "P0-EQN-002",
      "gate": "p0",
      "area": "equation",
      "given": "Invalid equations and raw LaTeX",
      "when": "they are compiled",
      "then": [
        "invalid equations diagnose precisely",
        "raw LaTeX is denied by default and bounded when explicitly trusted"
      ],
      "evidence": "automated",
      "required": true,
      "contracts": [
        "#7",
        "#9"
      ]
    },
    {
      "id": "P0-EQN-003",
      "gate": "p0",
      "area": "equation",
      "given": "Native mathematics grammar",
      "when": "readable Source is compiled",
      "then": [
        "closed-grammar Source parses into semantic trees with spelling-normalized identity",
        "unsupported notation is refused with stable-coded sub-ranged diagnostics and no silent fallback",
        "renderer-derived KaTeX TeX carries MathML for every native tree"
      ],
      "evidence": "automated",
      "required": true,
      "contracts": [
        "#7",
        "#12"
      ]
    },
    {
      "id": "P0-DRV-001",
      "gate": "p0",
      "area": "derivation",
      "given": "A derivation Block",
      "when": "it is compiled",
      "then": [
        "ordered `- expression:` steps parse into step trees with annotations and stable step-range diagnostics",
        "it renders aligned with annotations in step-then-annotation order"
      ],
      "evidence": "automated",
      "required": true,
      "contracts": [
        "#7",
        "#12"
      ]
    },
    {
      "id": "P0-MMD-001",
      "gate": "p0",
      "area": "mermaid",
      "given": "A Mermaid Block",
      "when": "it renders offline",
      "then": [
        "the SVG is deterministic, sanitized, and accessible",
        "active or invalid content fails safely"
      ],
      "evidence": "automated",
      "required": true,
      "contracts": [
        "#7",
        "#9"
      ]
    },
    {
      "id": "P0-PLT-001",
      "gate": "p0",
      "area": "plot",
      "given": "A native plot Block",
      "when": "it is compiled",
      "then": [
        "function and point series parse into authored-order series with evaluable trees and canonical exact decimals",
        "it renders deterministic browser-free SVG with gaps across undefined regions, error bars, legend, and accessible title and description"
      ],
      "evidence": "automated",
      "required": true,
      "contracts": [
        "#51",
        "#58"
      ]
    },
    {
      "id": "P0-PLT-002",
      "gate": "p0",
      "area": "plot",
      "given": "Invalid plot declarations and undefined regions",
      "when": "they are compiled",
      "then": [
        "unbound names, non-evaluable constructs, invalid data, and log-domain violations diagnose with stable codes and item ranges",
        "undefined samples gap without diagnostics and all-undefined series warn without failing"
      ],
      "evidence": "automated",
      "required": true,
      "contracts": [
        "#51",
        "#58"
      ]
    },
    {
      "id": "P0-CHT-001",
      "gate": "p0",
      "area": "chart",
      "given": "A bar-family chart Block",
      "when": "it is compiled",
      "then": [